email, priority, justification
allen-p_all_documents_495, 3, "The email contains questions and requests for information, but there is no explicit urgency or deadline mentioned."
allen-p_discussion_threads_221, 3, "The email is an update on an upcoming report, but there is no explicit urgency or immediate action required."
allen-p_sent_429, 2, "The email discusses several questions related to rent payments and requires immediate attention to resolve the missing rent issue."
allen-p__sent_mail_476, 2, "The email discusses missing rent payments and requires immediate attention to resolve the issue, but it is not an emergency."
arnold-j_all_documents_394, 3, "The email is a follow-up to a previous discussion about scheduling a workshop, and the sender is requesting a specific date and time."
arnold-j_all_documents_94, 2, "The email discusses a decision on purchasing tools and mentions a more definitive answer by Thursday."
arnold-j_all_documents_97, 4, "This email is a casual thank you note and does not require immediate action or response."
arnold-j_bmc_11, 3, "The email discusses ongoing evaluations and mentions a more definitive answer by Thursday, indicating a timely response is required but not immediate."
arnold-j_bmc_12, 4, "This email is a casual thank you note and does not require immediate action or response."
arnold-j_deleted_items_235, 4, "This email is a casual check-in about a non-urgent personal matter."
arnold-j_discussion_threads_468, 2, "The email discusses a contract that needs to be executed by the recipient's department and mentions an ongoing process of transferring another contract."
arnold-j_sent_211, 3, "The email is a follow-up to a previous discussion about scheduling a workshop, and the sender is requesting a specific time slot."
arnold-j__sent_mail_209, 3, "The email is a response to a previous email about scheduling a workshop, and the sender is providing their preferred date and time."
arnold-j_sony_1, 2, "The email mentions a Friday deadline and a call with the San Diego team tomorrow, indicating a need for a response by the end of the day."
badeer-r_all_documents_18, 4, "This email is an informative update on a new or revised operating procedure, with no immediate action required."
badeer-r_all_documents_201, 2, "The email discusses a potentially serious issue impacting market efficiency and reliability, requiring attention and awareness."
badeer-r_all_documents_42, 4, "This email is an informative update about the cancellation of a warning notice, with no immediate action required."
badeer-r_all_documents_44, 1, "The email mentions a Stage 1 Emergency and requires immediate action due to lack of resources."
badeer-r_all_documents_52, 1, "The email mentions a Stage 1 Emergency and requires immediate action to address reserve deficiency."
badeer-r_all_documents_61, 4, "This email is an informative update about the cancellation of a warning notice, with no immediate action required."
badeer-r_discussion_threads_14, 1, "The email discusses a Stage 2 System Emergency and includes a preliminary finding, indicating an urgent situation."
badeer-r_discussion_threads_216, 4, "This email is an update on the cancellation of a previous warning notice, but does not require immediate action."
badeer-r_discussion_threads_233, 1, "This email discusses an emergency situation and requires immediate action to address the lack of resources."
badeer-r_discussion_threads_234, 1, "The email discusses the termination of Stage 1 of the Electrical Emergency Plan, indicating an immediate action and crisis."
badeer-r_discussion_threads_235, 4, "This email is an informative update about the cancellation of a warning notice, with no immediate action required."
badeer-r_discussion_threads_259, 4, "This email is an informative update on a new or revised operating procedure, with no immediate action required."
badeer-r_discussion_threads_87, 2, "The email discusses a potentially serious issue impacting market efficiency and reliability, requiring attention but not immediate action."
badeer-r_notes_inbox_42, 4, "This email is an update on the cancellation of a warning notice, but does not require immediate action or response."
badeer-r_notes_inbox_43, 1, "The email discusses the termination of Stage 1 of the Electrical Emergency Plan, which implies an urgent situation."
bailey-s_all_documents_14, 4, "This is an out of office auto-reply, indicating no immediate response or action is required."
bailey-s_deleted_items_206, 2, "The email informs about an upcoming outage for Outlook Web Access, which may impact users' ability to access their emails."
bass-e_all_documents_16, 5, "This email is promotional material for GiftBaskets.com and does not require immediate attention or response."
bass-e_discussion_threads_1252, 5, "This email is promotional material from GiftBaskets.com, advertising their holiday shipping deadlines and gift options."
bass-e_notes_inbox_6, 5, "This email is promotional material for GiftBaskets.com and does not require immediate attention or response."
baughman-d_deleted_items_382, 1, "The email discusses an immediate threat of a virus circulating within the company's email system and requires immediate action to prevent further damage."
baughman-d_deleted_items_98, 3, "This email contains routine updates on system availability and outages for the weekend, with no urgent action required."
baughman-d_enron_power_fundamentals_4, 2, "The email discusses an issue at the Quad Cities plant that may impact operations and requires timely attention."
baughman-d_inbox_91, 1, "This email discusses an immediate crisis and requires immediate action to prevent the spread of a virus."
baughman-d_power_fundamentals_4, 3, "This email provides an update on an incident at a power plant, but there is no immediate action required or urgent deadline."
beck-s_all_documents_1557, 2, "Mandatory workshops for team members with a deadline in mid-October."
beck-s_all_documents_2327, 2, "The email discusses a personnel move and package details, requiring a timely decision or input."
beck-s_all_documents_3413, 4, "This email is about a travel upgrade confirmation and does not require immediate action."
beck-s_all_documents_3678, 4, "This email is a casual appreciation of a memo and a holiday wish, with no immediate action required."
beck-s_all_documents_500, 4, "This email is providing general information about a monthly report and does not require immediate action."
beck-s_analyst_assoc_program_10, 2, "Mandatory workshops for team members with a deadline in mid-October."
beck-s_deleted_items_4, 3, "This email provides information about a weekend outage report, but does not require immediate action or response."
beck-s_discussion_threads_1191, 3, "This email contains important dates and information about invoice processing, but does not require immediate action or response."
beck-s_discussion_threads_1572, 2, "The email discusses mandatory workshops for team members and requires a response to select a date and time."
beck-s_discussion_threads_1664, 2, "The email discusses the need for a disaster recovery plan and mentions the importance of developing it quickly, but allows for discussion next week."
beck-s_discussion_threads_36, 3, "The email discusses presentations and updates on the Metals group, but there is no explicit urgency or deadline mentioned."
beck-s_discussion_threads_452, 4, "This email is providing general information about a monthly report and does not require immediate action."
beck-s_europe_120, 2, "Discusses an employee's move to Houston and the need for more concrete details on their package, indicating a timely response is needed."
beck-s_inbox_293, 3, "The email discusses updates on an ongoing project and mentions that it is not urgent from the recipient's standpoint."
beck-s_sap_21, 3, "This email contains important dates and information about the transition from MSA to SAP systems, but does not require immediate action or response."
beck-s_sent_800, 4, "This email is a non-urgent update about the sender's vacation and key contacts during their absence."
beck-s_sent_916, 4, "This email is a casual check-in and discussion about a trip, with no immediate response required."
beck-s_sent_929, 4, "This email is about an upgrade confirmation and does not require immediate action or response."
beck-s__sent_mail_452, 3, "This email is a follow-up on a previous discussion and provides information on how to charge costs, but does not indicate an urgent deadline."
beck-s__sent_mail_793, 4, "This email is a non-urgent update about the sender's vacation and key contacts during their absence."
beck-s__sent_mail_922, 4, "This email is about a travel upgrade confirmation and does not require immediate action or response."
benson-r_deleted_items_66, 1, "The email mentions an immediate action required to delete a virus-infected email and provides instructions to prevent further spread."
benson-r_inbox_100, 1, "The email is requesting 24-hour contact information, implying an urgent need for immediate action."
benson-r_inbox_276, 1, "The email mentions an immediate action (outage) and its impact on essential functions (email, calendar, contacts, etc.)."
benson-r_inbox_98, 1, "The email mentions the closure of the building and encourages staff to dial in only for emergencies and critical business operations."
blair-l_itinerary_off_duty_5, 4, "The email is a casual notification about the sender's vacation and provides contact information for emergencies."
blair-l_tropical_storm_allison_1, 4, "This email is discussing a follow-up plan for employees and does not require immediate action or response."
buy-r_deleted_items_25, 3, "This email contains routine updates on system availability and scheduled outages, with no indication of urgency or immediate action required."
buy-r_inbox_390, 2, "The email requests employees to verify their contact information by the end of the day, making it a high priority but not an emergency."
buy-r_inbox_414, 4, "The email provides emergency contact information for the RAC group, but does not require immediate action or response."
buy-r_inbox_461, 1, "The email contains an urgent notice about the postponement of a meeting and requires immediate acknowledgment."
buy-r_sent_items_119, 1, "The email mentions an urgent need for a meeting within the next 2 days to discuss capital allocation and risk, as well as issues with counterparties and liquidity."
campbell-l_all_documents_1092, 1, "This email contains an alert about a curtailment order for interruptible customers, which requires immediate attention and action."
campbell-l_all_documents_1150, 1, "This email contains an alert about a curtailment order for interruptible customers, which requires immediate attention and action."
campbell-l_all_documents_1257, 3, "This email is a request for clarification on schedule deviations and their consequences, but there is no explicit urgency or deadline mentioned."
campbell-l_all_documents_1780, 5, "This email is promotional material and an unsolicited sales pitch."
campbell-l_discussion_threads_1025, 1, "The email mentions a curtailment order for interruptible customers, which is an immediate action required for the following day."
campbell-l_discussion_threads_1076, 3, "This email contains routine business inquiries and requests for information, with no explicit urgency mentioned."
campbell-l_discussion_threads_1132, 3, "This email is a request for clarification on schedule deviations and their consequences, but there is no explicit urgency or deadline mentioned."
campbell-l_discussion_threads_1612, 5, "This email is promotional material and an unsolicited sales pitch."
campbell-l_inbox_160, 1, "The email is sent in response to an emergency situation and provides important contact information for immediate travel assistance."
campbell-l_inbox_494, 5, "This email is promotional and does not require a response or attention."
campbell-l_inbox_855, 1, "The email discusses the activation of emergency programs and provides a specific time frame for the activation."
campbell-l_notes_inbox_207, 1, "The email mentions a curtailment order for interruptible customers, which is an immediate action required and has significant consequences if not addressed."
campbell-l_notes_inbox_327, 3, "This email provides an update on a policy change discussed in a previous meeting and does not require immediate action."
campbell-l_notes_inbox_570, 5, "This email is promotional material and an unsolicited sales pitch."
campbell-l_weekly_activity_report_9, 3, "This email provides updates on meetings, submissions, and training, but does not require immediate action or response."
carson-m_deleted_items_76, 5, "This email is promotional material and unsolicited sales pitch."
cash-m_deleted_items_408, 2, "The email discusses an urgent matter related to company policies and requires input on a drafted memo."
cash-m_inbox_121, 1, "The email mentions 'Urgent' and 'Importance: High', indicating immediate action is required."
cash-m_inbox_192, 4, "This is an automated out-of-office reply, indicating no immediate response or action is required."
cash-m_inbox_279, 3, "The email is a follow-up on a previous discussion and does not indicate an urgent deadline."
cash-m_n_form_4, 3, "The email is about a policy update and requests review and comments, but there is no explicit urgency or deadline mentioned."
cash-m_prc_7, 2, "The email discusses an ongoing employment tribunal and requires information urgently."
cash-m_sent_items_203, 1, "The subject line contains 'URGENT' and the email discusses a retention stock option plan that requires immediate attention."
cash-m_sent_items_218, 1, "The email subject and content explicitly mention urgency and request for prompt response."
cash-m_sent_items_312, 1, "The subject line contains the word 'Urgent', indicating immediate action is required."
cash-m_sent_items_327, 1, "The subject line contains the word 'Urgent' and discusses a financing/pension issue, which may have significant negative consequences if not addressed promptly."
cash-m_sent_items_345, 2, "The email mentions an urgent data request and the need to provide the information as soon as possible."
cash-m_sent_items_472, 1, "The email discusses emergency response procedures, which are crucial for safety and require immediate attention."
causholli-m_inbox_37, 3, "This email requests an update on emergency contact information, but does not imply an immediate deadline or urgent need."
causholli-m_inbox_93, 1, "The email is requesting immediate action to update emergency contact information."
corman-s_deleted_items_140, 1, "Emergency maintenance on the server is scheduled, and it will impact the availability of certain sites."
crandell-s_deleted_items_5, 2, "The email has 'URGENT' in the subject line and requires confirmation on the same day."
crandell-s_deleted_items_61, 3, "This email contains routine updates on system availability and outages, with no urgent action required."
crandell-s_deleted_items_89, 1, "The email mentions an urgent drug test that needs to be completed by a specific deadline, which has significant consequences for employment."
crandell-s_sent_items_4, 1, "The email is marked as urgent and requires confirmation on the same day."
dasovich-j_administrative_23, 3, "This email provides an update on approved RCRs and instructions for requesting new ones, but does not indicate an urgent deadline or immediate action required."
dasovich-j_all_documents_10297, 4, "This email shares a quote and suggests using it in future discussions, but there is no immediate action required or deadline mentioned."
dasovich-j_all_documents_10348, 3, "This email is an update on an ongoing issue, but there is no explicit urgency or immediate action required."
dasovich-j_all_documents_10492, 3, "This email provides an update on legislative measures related to the energy emergency, but does not require immediate action or response."
dasovich-j_all_documents_10798, 3, "This email is a follow-up on a previous discussion and requests information, but there is no explicit urgency or deadline mentioned."
dasovich-j_all_documents_1100, 1, "The email contains an 'Emergency Motion' and requires immediate attention."
dasovich-j_all_documents_11014, 3, "The email discusses a proposal and asks for comments, but does not mention any urgent deadlines or immediate action required."
dasovich-j_all_documents_12166, 4, "The email is discussing historical data and definitions related to the frequency of emergencies, but there is no immediate action required or deadline mentioned."
dasovich-j_all_documents_12206, 1, "The email discusses a 'WARNING' for energy systems and requests immediate voluntary curtailment of nonessential electric load to avoid severe conditions."
dasovich-j_all_documents_12222, 1, "The email declares a Stage 2 Emergency and requests immediate action to curtail nonessential electric load."
dasovich-j_all_documents_12290, 2, "The email discusses the urgency of a conference call and the need for a quick response to confirm availability."
dasovich-j_all_documents_12345, 4, "This email contains general information and attachments related to an energy briefing paper and timeline, with no urgent action required."
dasovich-j_all_documents_12732, 2, "The email contains a briefing paper and timeline for an energy emergency, which may require a timely response or action."
dasovich-j_all_documents_12925, 3, "The email is a follow-up on a previous discussion and does not indicate urgency or immediate action."
dasovich-j_all_documents_13091, 1, "The email discusses the current energy crisis and includes a timeline, indicating an urgent situation that requires immediate attention."
dasovich-j_all_documents_13433, 1, "The email mentions the need for immediate review and that the tickets will be booked today."
dasovich-j_all_documents_1612, 2, "The email requests an action to be taken ASAP, but it is not an emergency or crisis situation."
dasovich-j_all_documents_1849, 3, "The email discusses FERC's NE cap and utilities data, but does not indicate an urgent need for action or response."
dasovich-j_all_documents_2272, 3, "This email is a follow-up with additional information on a previous discussion, but there is no explicit urgency or deadline mentioned."
dasovich-j_all_documents_2436, 4, "This email is an informative update on a project's progress, with no immediate action required."
dasovich-j_all_documents_2438, 4, "This email is an informative update on a successful ISO auction, with no immediate action required."
dasovich-j_all_documents_2440, 3, "This email provides updates on ongoing projects and no explicit or implied rush is mentioned."
dasovich-j_all_documents_28076, 4, "This email contains an updated energy timeline and is informative in nature."
dasovich-j_all_documents_28284, 3, "The email contains an update on an ongoing project and is not explicitly urgent or time-sensitive."
dasovich-j_all_documents_28400, 2, "The email discusses a meeting with a specific time and date, and requires the recipients to send their assigned language by a deadline."
dasovich-j_all_documents_28814, 4, "This email is an invitation to a breakfast briefing event, not directly related to immediate work needs."
dasovich-j_all_documents_28995, 4, "This email is a casual check-in and does not require immediate attention."
dasovich-j_all_documents_2919, 3, "This email is a reminder for a staff meeting and a request for agenda items, which requires a timely response but is not urgent."
dasovich-j_all_documents_2983, 2, "The email discusses a deadline for filing comments and asks for thoughts and input from the recipients."
dasovich-j_all_documents_3685, 4, "This email is an informative update on registration and fee payments, with no immediate action required."
dasovich-j_all_documents_4359, 3, "The email provides updates on recent advice letters and mentions an issue with a blank attachment, but does not require immediate action."
dasovich-j_all_documents_4497, 1, "The email subject mentions an emergency petition, indicating immediate action is required."
dasovich-j_all_documents_4543, 1, "The email mentions an emergency filing and requires immediate attention."
dasovich-j_all_documents_4563, 3, "This email provides information about a filing for emergency relief but does not require immediate action or response."
dasovich-j_all_documents_4568, 3, "This email provides information about a filing for emergency relief but does not require immediate action or response."
dasovich-j_all_documents_643, 4, "The email contains informative articles about the California power crisis, but no immediate action or response is required."
dasovich-j_all_documents_7901, 1, "The email discusses an emergency situation and requires immediate attention."
dasovich-j_all_documents_7925, 4, "This email provides holiday contact numbers and is informative, but not urgent."
dasovich-j_all_documents_7961, 4, "This email is an out-of-office notification with no immediate action required."
dasovich-j_all_documents_832, 1, "The email discusses a crisis of confidence in electricity markets and the need for an urgent study to keep deregulation on track."
dasovich-j_all_documents_8343, 1, "The email discusses an emergency petition related to gas pricing and potential negative consequences for core customers."
dasovich-j_all_documents_8346, 4, "The email contains additional reading materials for a workshop, but there is no mention of urgency or immediate action required."
dasovich-j_all_documents_8452, 1, "The email mentions 'gas emergency' and requires support, indicating immediate action is needed."
dasovich-j_all_documents_8743, 4, "This email is a casual check-in and congratulations, with no immediate response required."
dasovich-j_all_documents_8748, 4, "This email is a non-urgent update on who has requested a copy of the Manifesto."
dasovich-j_all_documents_9169, 1, "The email mentions an emergency petition and requires immediate attention."
dasovich-j_all_documents_9218, 2, "The email discusses the need for information on California legislation for a briefing book and knowledge management purposes, with a deadline of Tuesday at Noon."
dasovich-j_all_documents_9776, 3, "The email is a request for information about legislation and regulations, but there is no explicit urgency or deadline mentioned."
dasovich-j_all_documents_9874, 2, "The email discusses a potential issue with the Kern River expansion and requests information and a call on Thursday at 4pm Houston time."
dasovich-j_california_crisis__press_20, 4, "This email is an informative update on FERC's stance on deregulation and does not require immediate action."
dasovich-j_deleted_items_113, 1, "The email mentions an urgent matter and a specific time (3:00 p.m.) for discussion."
dasovich-j_deleted_items_360, 4, "This email is a confirmation of a car reservation, which is informative but not urgent."
dasovich-j_inbox_1642, 5, "This email is promotional material for a free news service and does not require immediate attention."
dasovich-j_inbox_195, 3, "This email is an update on a resolution passed by the Senate, but there is no explicit urgency or immediate action required."
dasovich-j_inbox_449, 1, "The email mentions a crisis and requires immediate action to decide what to do."
dasovich-j_notes_inbox_11517, 1, "The email mentions a critical migration process and potential loss of information if not addressed promptly."
dasovich-j_notes_inbox_12146, 2, "The email discusses a plan and deadlines for drafting language on specific issues, with a deadline of Monday 7/9 at 5:00pm."
dasovich-j_notes_inbox_12489, 4, "The email provides general information about a filed document and does not require immediate action."
dasovich-j_notes_inbox_1268, 1, "The email mentions an emergency motion and immediate action required for a cease and desist order."
dasovich-j_notes_inbox_1342, 3, "This email is a routine update on a staff meeting and agenda items, with no urgent deadlines mentioned."
dasovich-j_notes_inbox_1548, 2, "The email discusses significant re-writes and seeks clarification before filing, indicating a need for a timely response."
dasovich-j_notes_inbox_1812, 4, "This email is an update on registration and provides information on fee payments, but does not require immediate action."
dasovich-j_notes_inbox_2408, 4, "This email is a forwarded press release and does not require immediate action or response."
dasovich-j_notes_inbox_2409, 1, "The email subject mentions an emergency petition, indicating immediate action is required."
dasovich-j_notes_inbox_2441, 1, "The email mentions an emergency filing and requires immediate attention."
dasovich-j_notes_inbox_2451, 1, "The email mentions an emergency FERC filing and is forwarded as FYI, indicating immediate attention is required."
dasovich-j_notes_inbox_2459, 3, "This email is an update on an ongoing project and does not indicate urgency or immediate action required."
dasovich-j_notes_inbox_2646, 1, "The email mentions the need for immediate review and action, as the tickets are being booked today."
dasovich-j_notes_inbox_2901, 1, "The email discusses the current energy crisis and includes a timeline, indicating an urgent situation that requires immediate attention."
dasovich-j_notes_inbox_3187, 2, "The email contains a briefing paper and timeline for an energy emergency, suggesting a need for a timely response."
dasovich-j_notes_inbox_3303, 4, "The email provides informative links and an attachment related to emergency standby generators, but does not require immediate action or response."
dasovich-j_notes_inbox_3512, 1, "The email declares a Stage 2 Emergency and requests immediate action to curtail nonessential electric load."
