email, priority, justification
rogers-b_deleted_items_100, 4, "This email is a general information about the observance of Martin Luther King Day and the availability of HelpDesk Support."
rogers-b_discussion_threads_1768, 3, "This email provides information on Unit 3's numbers and does not indicate any urgency or immediate action required."
rogers-b_discussion_threads_1862, 3, "This email provides information about contracts and their labeling, but does not indicate an urgent need for action."
rogers-b_genco_jv_ipo_27, 3, "This email provides information about contracts and their labeling, but does not indicate an urgent need for action."
rogers-b_genco_jv_ipo_65, 3, "This email provides information on Unit 3's numbers and does not indicate any urgency or immediate action required."
rogers-b_inbox_217, 1, "The email mentions an emergency maintenance and an outage, which requires immediate attention and action."
rogers-b_inbox_29, 4, "This email is a casual message with non-urgent content."
rogers-b_sent_102, 3, "The email provides answers to questions and updates on ongoing tasks, but does not indicate urgency or immediate action required."
sager-e_all_documents_1160, 1, "The email mentions 'urgent' in the subject and requires a response ASAP due to a tight schedule."
sager-e_all_documents_244, 4, "The email is a casual response to a previous discussion and does not require immediate action."
sager-e_inbox_750, 3, "The email is about a meeting scheduled for Monday, November 5, and does not mention any urgent or time-sensitive issues."
saibi-e_inbox_1021, 2, "The email requests emergency contact information, but does not mention an immediate crisis or deadline."
saibi-e_inbox_383, 1, "This email discusses an immediate threat to the company's network security and requires immediate action to prevent potential damage."
saibi-e_inbox_503, 3, "This email requests updates on personal information but does not indicate an urgent deadline or immediate consequences."
saibi-e_inbox_697, 1, "The email mentions an emergency maintenance and an outage that will impact access to essential functions like email and calendar."
salisbury-h_inbox_1033, 3, "This email discusses a new transmission idea and provides information on a potential path, but does not require immediate action or response."
salisbury-h_inbox_1048, 4, "This email provides general information about an earthquake, but does not require immediate action or response."
salisbury-h_inbox_1063, 1, "The email mentions 'URGENT' and discusses potential interruptions of firm load, indicating immediate action is required."
salisbury-h_inbox_1084, 4, "The email provides general information about an earthquake, but no immediate action is required as there are no reports of damage or casualties."
salisbury-h_inbox_1124, 1, "The email contains an urgent weather message and a wind advisory that requires immediate attention."
salisbury-h_inbox_1131, 1, "The email contains an urgent weather message and a wind advisory that requires immediate attention."
salisbury-h_inbox_1149, 1, "The email declares a STAGE 2 Electrical Emergency, which requires immediate action and attention."
salisbury-h_inbox_1153, 1, "The email declares a STAGE 1 Electrical Emergency, which requires immediate action and attention."
salisbury-h_inbox_158, 1, "This email discusses an immediate crisis and potential negative consequences if not addressed promptly."
salisbury-h_inbox_193, 1, "The email discusses an immediate virus threat and requires immediate action to prevent further damage."
salisbury-h_inbox_429, 3, "This email is about a planned power testing event and asks recipients to power down their equipment, but it is not an urgent or time-sensitive issue."
salisbury-h_inbox_545, 3, "This email requests updates on personal information but does not mention any urgent deadline or immediate consequences."
salisbury-h_inbox_630, 1, "Mentions emergency staff and the need for travel assistance in light of a crisis."
salisbury-h_inbox_631, 1, "The email is requesting 24-hour contact information, implying an urgent need for immediate action."
salisbury-h_inbox_633, 1, "The email mentions the closure of the building and encourages staff to dial in only for emergencies and critical business operations."
salisbury-h_inbox_759, 1, "The email mentions a flash flood warning and immediate action required for residents in the affected area."
salisbury-h_inbox_760, 1, "The email contains an immediate flash flood warning and requires urgent action to ensure safety."
salisbury-h_inbox_788, 1, "This email contains a Red Flag Warning for scattered dry thunderstorms, which is an emergency situation that requires immediate attention."
salisbury-h_inbox_792, 1, "The email mentions a Red Flag Warning and Fire Weather Watch, indicating an emergency situation that requires immediate attention."
salisbury-h_inbox_797, 1, "This email contains a Red Flag Warning for scattered dry thunderstorms, which is an emergency situation that requires immediate attention."
salisbury-h_inbox_801, 1, "The email discusses a fire weather watch and potential dry lightning, which can have significant negative consequences if not addressed promptly."
salisbury-h_inbox_806, 1, "This email discusses a fire weather watch and potential dry lightning, which is an emergency situation requiring immediate action."
salisbury-h_inbox_895, 1, "The email is related to a community warning system message and is marked as urgent."
salisbury-h_inbox_924, 2, "The email discusses a strong earthquake that occurred in Peru, which may have caused damage and requires attention."
salisbury-h_inbox_931, 1, "The email mentions a Stage 3 Electrical Emergency and rotating outages, which require immediate action and attention."
salisbury-h_inbox_932, 1, "The email mentions a 90-minute probability notice for rotating outages and estimates that outages could begin soon, making it an urgent situation requiring immediate action."
salisbury-h_inbox_939, 1, "The email mentions an electrical emergency and has a specific time frame for the emergency, indicating immediate action is required."
salisbury-h_inbox_946, 1, "The email mentions an electrical emergency and has a specific time frame for the emergency, indicating immediate action is required."
salisbury-h_inbox_947, 1, "The email declares a STAGE 1 Electrical Emergency and has an urgent label in the subject."
salisbury-h_inbox_964, 1, "The email discusses a potential emergency situation in the city of Richmond and provides contact information for immediate questions."
salisbury-h_read_104, 1, "The email declares a STAGE 2 Electrical Emergency, which is a crisis situation requiring immediate action."
salisbury-h_read_114, 1, "The email declares a STAGE 2 Electrical Emergency, which requires immediate action and has significant negative consequences if not addressed promptly."
salisbury-h_read_120, 1, "The email discusses a cancellation of a STAGE 2 electrical emergency, which implies immediate action and potential consequences if not addressed."
salisbury-h_read_121, 4, "This email is an informative update on the cancellation of load interruptions, with no immediate action required."
salisbury-h_read_124, 1, "The email mentions a Stage 3 load interruption, which is a crisis situation requiring immediate action."
salisbury-h_read_125, 1, "The email declares a STAGE 3 Electrical Emergency with a specific time frame, indicating immediate action is required."
salisbury-h_read_128, 1, "The email declares a STAGE 2 Electrical Emergency, which requires immediate action and has significant negative consequences if not addressed promptly."
salisbury-h_read_15, 4, "This email is an informative update about an earthquake, but does not require immediate action or response."
salisbury-h_read_50, 1, "The email mentions an immediate threat of flooding and requires urgent action to protect life and property."
salisbury-h_read_6, 4, "This email provides general information about an earthquake in Indonesia and does not require immediate action."
salisbury-h_read_75, 4, "The email is a test message and explicitly asks the recipient to disregard it."
salisbury-h_sent_items_136, 3, "The email is a request to be included in a distribution list, and there is no explicit urgency mentioned."
salisbury-h_sent_items_35, 2, "The email requests important information related to emergency contacts, but does not mention an immediate deadline."
salisbury-h_sent_items_45, 4, "The email is a follow-up on updating emergency contact information, which is not urgent or time-sensitive."
sanders-r_all_documents_1153, 2, "The email discusses an ongoing legal matter with an approaching deadline (Monday) and requires a decision on retaining counsel."
sanders-r_all_documents_2227, 1, "The email mentions a critical migration process and potential loss of information if not addressed promptly."
sanders-r_all_documents_3862, 1, "The email contains an urgent report and mentions priority items that need to be addressed."
sanders-r_all_documents_5185, 1, "The email mentions an emergency motion, a hearing, and requires immediate review and consideration."
sanders-r_deleted_items_237, 1, "This email discusses an immediate threat to the company's network and requires immediate action to prevent the spread of a virus."
sanders-r_deleted_items_392, 3, "This email contains routine updates on system availability and scheduled outages, with no indication of urgency."
sanders-r_notes_inbox_179, 1, "The email mentions an emergency motion, a hearing, and requires immediate review and consideration."
sanders-r_notes_inbox_71, 1, "The email mentions a critical migration process and potential loss of information if not addressed promptly."
sanders-r_sent_items_206, 1, "The email mentions an urgent legal matter with a short answer date, requiring immediate attention."
schoolcraft-d_inbox_junk_583, 2, "The email discusses an upcoming outage for Outlook Web Access, which may impact users' ability to access their email."
schwieger-j_deleted_items_156, 3, "This email contains updates on invoices and a statement, but does not mention any urgent deadlines or immediate action required."
schwieger-j_sent_items_15, 2, "The email requests information urgently and is related to Enron's storage capacity in Texas."
scott-s_all_documents_1413, 3, "The email is asking for more information about the presentation times, but there is no explicit urgency or deadline mentioned."
scott-s_all_documents_916, 3, "This email provides information about a filing for emergency relief but does not require immediate action or response."
scott-s_deleted_items_158, 3, "This email contains routine updates on system availability and scheduled outages, with no indication of urgency."
scott-s_deleted_items_256, 2, "The email discusses an upcoming outage for Outlook Web Access, which may impact users' ability to access their email."
scott-s_inbox_111, 4, "This email is a casual check-in and does not require immediate attention."
scott-s_notes_inbox_36, 3, "This email is an update on an ongoing project and does not indicate any urgency or immediate action required."
scott-s_sent_602, 3, "The email is a follow-up asking for more information about presentation times, not an urgent request or deadline."
semperger-c_deleted_items_142, 3, "This email contains routine updates on system availability and outages for the weekend, with no urgent action required."
shackleton-s_all_documents_10108, 1, "The email mentions urgent calls from traders and requests a call as soon as the email is received."
shackleton-s_all_documents_10148, 3, "Routine business inquiry, no explicit or implied rush."
shackleton-s_all_documents_10280, 3, "The email is a follow-up on a previous urgent request, but the current content does not indicate any urgency or immediate action required."
shackleton-s_all_documents_10297, 3, "The email discusses rescheduling a meeting, but there is no explicit urgency or deadline mentioned."
shackleton-s_all_documents_10761, 4, "This email is a casual heads-up about a potential delay in arrival to a meeting."
shackleton-s_all_documents_10839, 3, "This email is a routine update on the reassignment of ISDA Master Agreements and does not indicate urgency."
shackleton-s_all_documents_11042, 3, "The email is a follow-up on a previous discussion about preparing an ISDA Agreement, but there is no explicit urgency or deadline mentioned."
shackleton-s_all_documents_1735, 3, "This email discusses incorporating agreements into a database and access for a colleague, but does not mention any urgent deadlines or immediate consequences."
shackleton-s_all_documents_1831, 4, "This email is an informative update about a new travel and medical emergency assistance provider, with no immediate action required."
shackleton-s_all_documents_3398, 1, "The email contains the word 'URGENT' and requests immediate action to execute and send the documents."
shackleton-s_all_documents_3464, 1, "The subject line and content mention the situation has become urgent and requires immediate attention."
shackleton-s_all_documents_4716, 1, "The email mentions an urgent need for specific documents related to a prepay closing tomorrow, requiring immediate action."
shackleton-s_all_documents_4746, 2, "The email discusses an issue impacting ongoing operations and requires a timely decision or input."
shackleton-s_all_documents_8597, 1, "The email is marked as URGENT and requires immediate action to print, sign, and fax documents."
shackleton-s_all_documents_9063, 2, "The email discusses priority brokerage agreements and the progress made on them, requiring a timely response."
shackleton-s_all_documents_9069, 1, "The email subject and content mention 'Urgent' and a 'major priority', indicating immediate action is required."
shackleton-s_all_documents_989, 3, "This email is a follow-up on previous discussions and does not indicate an urgent need for a response."
shackleton-s_all_documents_9930, 1, "The email discusses an emergency password reset due to a death in the family and time-sensitive documents."
shackleton-s_deleted_items_503, 2, "The email discusses an upcoming outage for Outlook Web Access, which may impact users' ability to access their email."
shackleton-s_deleted_items_97, 1, "The email announces an emergency maintenance and server outage, which will impact essential functions like email and calendar access."
shackleton-s_inbox_773, 2, "The email mentions a deadline for updates related to the March 15 paycheck and asks to send the email as urgent for expedited processing."
shackleton-s_nelson_3, 1, "The email mentions 'Urgent' in the subject and discusses a major priority project that requires immediate attention."
shackleton-s_nelson_75, 3, "The email is a follow-up on a previous discussion and does not mention any urgency or deadlines."
shackleton-s_notes_inbox_1142, 1, "The email subject and content mention the situation as 'URGENT' and request a call for questions."
shackleton-s_notes_inbox_1146, 4, "This email is a casual notification about the sender's absence and does not require immediate action."
shackleton-s_notes_inbox_1261, 4, "The email is informing about the sender's absence and who will be covering for them, but no immediate action is required."
shackleton-s_notes_inbox_2182, 4, "This email is a general out-of-office notification with no immediate action required."
shackleton-s_notes_inbox_2833, 1, "The email discusses an emergency password reset due to a death in the family and time-sensitive documents."
shackleton-s_notes_inbox_2834, 1, "The email discusses an emergency password reset due to a death in the family and time-sensitive documents."
shackleton-s_sent_1234, 3, "This email discusses incorporating agreements into a database and access for a colleague, but does not mention any urgent deadlines or immediate consequences."
shackleton-s_sent_2043, 1, "The subject line contains 'URGENT!!!' and the email discusses details that will be provided shortly."
shackleton-s_sent_2370, 1, "The email mentions an urgent need for specific documents related to a prepay originating from London that closes tomorrow, requiring immediate action."
shackleton-s_sent_2545, 1, "The email mentions an urgent matter and requests quick execution of a guaranty."
shackleton-s_sent_2551, 2, "The email discusses an urgent request related to a guaranty and requires action as soon as possible."
shackleton-s_sent_5901, 1, "The email mentions urgent calls from ECI traders and requests a call as soon as the email is received."
shackleton-s_sent_5921, 3, "Routine business inquiry, no explicit or implied rush."
shackleton-s_sent_5952, 3, "The email is a follow-up on a previous urgent request, but the current email does not require immediate action."
shackleton-s_sent_6127, 4, "This email is a casual heads-up about a potential delay in arrival to a meeting, with no immediate action required."
shackleton-s_sent_6151, 3, "The email is a routine update on ongoing projects and requests for reassignment, with no explicit urgency mentioned."
shackleton-s_sent_6207, 3, "The email is a follow-up on a previous discussion about preparing an ISDA Agreement, but there is no explicit urgency or deadline mentioned."
shackleton-s_sent_702, 3, "This email is a follow-up on previous discussions and does not indicate an urgent need for a response."
shackleton-s_sent_items_630, 3, "This email is a routine request for information and does not indicate urgency."
shackleton-s_sent_items_634, 1, "The email contains an attachment marked as urgent and requires immediate attention."
shankman-j_all_documents_223, 4, "This email is a casual check-in and does not require immediate action or response."
shankman-j_all_documents_641, 4, "This email is about a holiday party and a gallery talk, which are not urgent or directly related to immediate work needs."
shankman-j_all_documents_877, 4, "This email is a casual conversation between colleagues discussing personal plans and interests."
shankman-j_all_documents_896, 4, "This email is a casual conversation about scheduling a meeting and discussing personal experiences, with no immediate action required."
shankman-j_discussion_threads_257, 4, "This email is about a holiday party and a gallery talk, which are not urgent or directly related to immediate work needs."
shankman-j_discussion_threads_458, 4, "This email is a casual check-in and does not require immediate action."
shankman-j_sent_160, 4, "This email is a casual check-in and does not require immediate action."
shankman-j_sent_772, 4, "This email is a casual conversation between colleagues discussing personal plans and interests."
shankman-j_sent_791, 4, "This email is a casual conversation about scheduling a meeting and does not require immediate action."
shapiro-r_all_documents_1813, 1, "The email mentions a presentation that must be delivered first thing Monday morning, and the sender requests input on a key subject."
shapiro-r_all_documents_252, 2, "The email requests a review of a draft article and asks for comments by Monday, April 2, indicating a time-sensitive deadline."
shapiro-r_all_documents_254, 2, "The email discusses an emergency request and a recent court ruling that impacts the ICAP charge, requiring the recipients to be informed and possibly take action."
shapiro-r_all_documents_726, 1, "The email discusses an emergency authority memo and requires immediate attention."
shapiro-r_deleted_items_247, 1, "The email explicitly mentions 'urgent' and 'immediate attention' and requires immediate action to disable charging rights."
shapiro-r_deleted_items_898, 4, "This is an out of office notification with no immediate action required."
shapiro-r_discussion_threads_1612, 1, "The email mentions a presentation that must be delivered first thing Monday morning, requiring immediate action and input from the recipients."
shapiro-r_discussion_threads_223, 2, "The email requests a review of a draft article and asks for comments by Monday, April 2, indicating a time-sensitive deadline."
shapiro-r_discussion_threads_653, 1, "The email discusses an emergency authority memo and requires immediate attention."
shapiro-r_discussion_threads_707, 3, "The email discusses proposed modifications and upcoming meetings, but does not indicate an immediate need for action or response."
shapiro-r_florida_3, 2, "The email requests a review of a draft article and asks for comments by Monday, April 2, indicating a time-sensitive deadline."
skilling-j_discussion_threads_1116, 4, "The email is an update on a non-urgent issue and does not require immediate action."
skilling-j_inbox_22, 2, "The email mentions a short notice opportunity and asks for an ASAP response if interested."
skilling-j_inbox_269, 4, "The email is an apology for a previous email and informs that the issue has been resolved."
skilling-j_inbox_911, 4, "This email is a casual check-in and social invitation related to work."
skilling-j__sent_mail_71, 1, "The subject line contains 'URGENT' and the email is discussing a mid-year process."
slinger-r_deleted_items_92, 1, "This email warns of an immediate threat of a virus circulating within the company's email system and requires immediate action to prevent potential damage."
slinger-r_sent_items_39, 3, "This email discusses a new transmission idea and provides a potential solution, but does not indicate urgency or immediate action required."
smith-m_inbox_154, 1, "The email mentions a bill that is set for debate today and requires immediate action from the recipient to call their state representative."
smith-m_inbox_7, 3, "This email is an update on a change made to the pipelines in the database and does not require immediate action."
solberg-g_deleted_items_240, 3, "This email provides information about a weekend outage report, but does not require immediate action or response."
solberg-g_deleted_items_641, 2, "The email requests the recipient to enter test deals on Saturday after the databases are back up, which is a time-sensitive task."
solberg-g_inbox_86, 1, "The email mentions an imminent deadline (Tuesday, 5th February) and states that employment cannot commence until the drug test is completed."
solberg-g_sent_items_15, 2, "The email mentions urgency and a need for action, but the sender is offering to pick up the certificate on Monday, suggesting a same-day or 24-hour response is appropriate."
steffes-j_california_issues_36, 3, "The email discusses a proposal and asks for thoughts, but does not mention any urgent deadlines or immediate action required."
steffes-j_deleted_items_612, 4, "This is an out of office auto-reply, indicating no immediate response or action is required."
steffes-j_sent_items_1540, 4, "This email is a casual check-in about vacation plans and provides contact information in case of urgent matters."
steffes-j_sent_items_629, 4, "The email is a non-urgent update about a personal situation and does not require immediate action."
stokley-c_chris_stokley_iso_mrkt_info_108, 1, "The email mentions emergency events and rescheduling of a meeting due to uncertainty for availability of key personnel."
stokley-c_chris_stokley_iso_mrkt_info_3, 3, "This email is an update on a new or revised operating procedure and provides a link to the ISO website for reference, but does not require immediate action."
stokley-c_chris_stokley_projects_ees__metering_and_forcasting_2, 2, "The email discusses rescheduling a meeting due to an emergency task force and asks for availability within the next two days."
stokley-c_chris_stokley_projects_ees__neil_b__12, 3, "This email is an update on an ongoing project and does not indicate any urgency or immediate action required."
stokley-c_chris_stokley_sent_122, 2, "The email discusses rescheduling a meeting and asks for the recipients' availability."
stokley-c_chris_stokley_sent_142, 2, "The email discusses a solution for accessing MV90 data and suggests creating an emergency work request, indicating a need for a timely response."
stokley-c_chris_stokley_volume_mang__100, 3, "This email is a routine business inquiry and clarification on a new order, with no explicit urgency mentioned."
stokley-c_chris_stokley_volume_mang__70, 4, "The email is a casual update about the sender's preference for communication during the week, with no immediate action required."
symes-k_all_documents_20, 2, "The email requests an action to be taken (printing, signing, and sending a letter), but there is no explicit mention of a deadline or immediate urgency."
symes-k_all_documents_3634, 4, "This email is informing about a temporary change in contact information and voice mail outage, but it is not urgent or time-sensitive."
symes-k_discussion_threads_3487, 4, "This email informs about a temporary voice mail outage and provides alternative contact information, but it is not urgent or time-sensitive."
symes-k_rainy_day_14, 2, "The email contains a request to print and send a letter, but there is no explicit mention of a deadline or immediate consequences."
symes-k_sent_12, 4, "The email explicitly states that it is not an urgent matter and to respond whenever the recipient has time."
symes-k_sent_1264, 3, "This email is an update on the voice mail system being down and provides alternative contact information."
symes-k__sent_mail_1202, 4, "The sender explicitly mentions that this is not an urgent request and can be attended to whenever the recipient has a free moment."
symes-k__sent_mail_1313, 4, "The email explicitly states that it is not an urgent matter and to respond whenever the recipient has time."
taylor-m_all_documents_1154, 2, "The email mentions an urgent need to make products available to the market and requests approval as soon as possible today."
taylor-m_all_documents_1193, 3, "This email is an update on a legal survey and does not indicate any urgency or immediate action required."
