email, priority, justification
dasovich-j_notes_inbox_3521, 1, "The email discusses a 'WARNING' for energy systems and requests immediate voluntary curtailment of nonessential electric load to avoid severe conditions."
dasovich-j_notes_inbox_3576, 1, "The subject line contains the word 'Urgent' and the email is about recalling a message, indicating immediate action is required."
dasovich-j_notes_inbox_4058, 3, "The email is asking for information about a bill and its impact on Enron, but there is no explicit urgency or deadline mentioned."
dasovich-j_notes_inbox_4651, 3, "This email provides an update on a legislative issue, but does not indicate an urgent need for action or response."
dasovich-j_notes_inbox_4705, 2, "The email discusses a potential rate increase and requests information on the legality and other related issues, requiring a response by the end of the day."
dasovich-j_notes_inbox_4982, 2, "The email discusses a potential issue with the Kern River expansion and requests information and a call on Thursday, indicating a timely response is needed."
dasovich-j_notes_inbox_5027, 3, "The email is a request for information about legislation and regulations, but there is no explicit urgency or deadline mentioned."
dasovich-j_notes_inbox_5319, 2, "The email discusses modifications to decisions and requirements for noncore customers, which may impact ongoing operations and requires a timely response."
dasovich-j_notes_inbox_545, 2, "The email requests an action to be taken ASAP, but it is not an emergency or crisis situation."
dasovich-j_notes_inbox_5549, 4, "This email is a non-urgent update on who has requested a copy of the Manifesto."
dasovich-j_notes_inbox_5576, 2, "The email discusses information needed for a Senate hearing, which implies a time-sensitive decision or input."
dasovich-j_notes_inbox_5721, 1, "The email mentions 'gas emergency' and requests support, indicating immediate action is required."
dasovich-j_notes_inbox_5722, 1, "The email discusses an emergency application and potential legal actions, requiring immediate attention."
dasovich-j_notes_inbox_5787, 1, "The email is marked as URGENT and contains important workshop materials."
dasovich-j_notes_inbox_5790, 1, "The email discusses an emergency petition related to gas pricing and potential negative consequences for core customers."
dasovich-j_notes_inbox_5913, 1, "The email mentions an emergency motion and requires immediate attention."
dasovich-j_notes_inbox_6018, 4, "The email is an out-of-office notification with no immediate action required."
dasovich-j_notes_inbox_6039, 4, "This email provides contact information for the holiday period and is informative, but not urgent."
dasovich-j_notes_inbox_6048, 1, "The email discusses an emergency situation and requires immediate attention."
dasovich-j_notes_inbox_6082, 1, "The email mentions an emergency trade application upgrade and a scheduled call for the same day, indicating immediate action is required."
dasovich-j_sent_12095, 4, "This email is a casual check-in and does not require immediate attention."
dasovich-j_sent_2951, 2, "The email discusses a shortened time to respond to an emergency gas motion, indicating a time-sensitive decision or input is needed."
dasovich-j_sent_3829, 4, "This email shares a quote and suggests using it in future discussions, but there is no immediate action or response required."
dasovich-j_sent_4014, 3, "This email is a routine request for information with no explicit urgency or deadline mentioned."
dasovich-j_sent_4630, 4, "This email is sharing general information and resources related to standby generators, with no urgent action required."
dasovich-j_sent_4715, 3, "The email is asking for information about a bill, but there is no indication of urgency or immediate action required."
dasovich-j_sent_679, 4, "This email is an informative update on a project's progress, with no immediate action required."
dasovich-j_sent_items_154, 1, "The email is marked as 'Urgent' and 'High Importance', and mentions a call on hold, requiring immediate action."
davis-d_all_documents_223, 4, "This email is a casual check-in and request for help in filling out a contact list, with no urgent deadlines or immediate action required."
davis-d_all_documents_227, 4, "This email is a casual check-in and request for help in filling out a document, with no urgency mentioned."
davis-d_all_documents_408, 4, "This email is a casual check-in and conversation between colleagues, with no urgent or time-sensitive information."
davis-d_church_21, 4, "This email is a casual check-in and request for help in filling out a contact list."
davis-d_deleted_items_90, 4, "This is an out of office auto-reply, which is informative and does not require immediate action."
davis-d_discussion_threads_125, 4, "This email is a casual check-in and request for help in filling out a document, with no urgency mentioned."
davis-d_discussion_threads_156, 4, "This email is a casual check-in and request for help in filling out a document, with no urgency indicated."
davis-d_discussion_threads_158, 4, "This email is a casual check-in and request for help in filling out a contact list."
davis-d_inbox_global_counterpary_2, 4, "This email is a casual update about Gloria being late and does not require immediate action."
davis-d_personal_30, 4, "The email is a non-urgent request for a task to be completed whenever the recipient is free."
davis-d_sent_144, 4, "This email is a casual check-in and conversation between colleagues, with no immediate action required."
davis-d_sent_68, 4, "This email is a casual check-in and request for help in filling out a document, with no urgency indicated."
davis-d_sent_70, 4, "This email is a casual check-in and request for help in filling out a document, with no urgent deadlines or immediate action required."
davis-d__sent_mail_90, 4, "This email is a casual check-in and conversation between colleagues, with no immediate action required."
dean-c_all_documents_156, 3, "This email is a request for information and has a deadline, but it is not urgent or critical."
dean-c_all_documents_210, 1, "The email mentions a weather alert and potential impact on operations, requiring immediate action."
dean-c_deleted_items_132, 1, "This email discusses an immediate crisis and potential negative consequences if not addressed promptly."
dean-c_deleted_items_9, 3, "The email contains information about system outages and their impact, but the events have already occurred and no immediate action is required."
dean-c_discussion_threads_207, 1, "The email mentions a weather alert and potential impact on operations, requiring immediate action."
dean-c_inbox_304, 1, "The email mentions an emergency maintenance and an outage that will impact access to email and other Outlook features."
dean-c_inbox_637, 4, "This email is a casual check-in and offers help, with no immediate response required."
dean-c_notes_inbox_20, 1, "The email mentions a weather alert and potential impact on operations, requiring immediate action."
delainey-d_deleted_items_3, 4, "This is an out of office auto-reply and does not require immediate action."
derrick-j_inbox_137, 3, "The email is offering help and assistance, but there is no explicit urgency or deadline mentioned."
derrick-j_inbox_163, 4, "This is an out of office auto-reply, indicating no immediate response or action is required."
derrick-j_inbox_167, 4, "This is an out of office auto-reply, which does not require immediate action or response."
derrick-j_sent_items_147, 1, "The email contains the word 'urgent' and requests approval for a motion as soon as possible."
derrick-j_sent_items_325, 1, "The subject line contains the word 'Urgent' and requests a response."
derrick-j_sent_items_438, 1, "The subject and content of the email mention 'Urgent' and require immediate action regarding the F&J Representation."
derrick-j_sent_items_440, 1, "The email mentions an urgent decision-making process and requires a reply ASAP."
donoho-l_inbox_junk_file_309, 2, "The email discusses an upcoming outage for Outlook Web Access, which may impact users' ability to access their email."
donoho-l_inbox_junk_file_335, 4, "This is an out of office auto-reply, indicating that the sender is not available and providing alternative contacts."
donoho-l_inbox_junk_file_404, 2, "The email mentions a deadline for updates related to the March 15 paycheck and asks to send the email as urgent for expedited processing."
dorland-c_deleted_items_105, 1, "The subject line contains 'URGENT REQUIRES IMMEDIATE ACTION', indicating immediate action is required."
ermis-f_inbox_167, 1, "This email discusses an immediate threat to the company's network security and requires immediate action to prevent potential damage."
ermis-f_inbox_93, 1, "The email discusses an immediate virus threat and requires immediate action to prevent further damage."
farmer-d_all_documents_1107, 2, "The email discusses a deal and requests action on rolling old deals or providing ticket numbers."
farmer-d_all_documents_1109, 1, "The email is marked as an urgent request and is related to a deal that has expired."
farmer-d_all_documents_1297, 1, "The email mentions that settlement is trying to close today and it is urgent to resolve the issue ASAP."
farmer-d_all_documents_3239, 1, "The email is marked as urgent and requests immediate action to compile a list of parties/points for excess volumes."
farmer-d_cornhusker_23, 3, "The email contains an initial draft for review and mentions a meeting next week, but no urgent issues are mentioned."
farmer-d_deleted_items_161, 5, "This email is promotional material and does not require a response or attention."
farmer-d_deleted_items_320, 5, "This email is a promotional message with no relevance to immediate work needs."
farmer-d_deleted_items_340, 5, "This email is promotional material and does not require a response or attention."
farmer-d_discussion_threads_1848, 1, "The email contains an urgent request and is related to a deal that requires immediate attention."
farmer-d_discussion_threads_4856, 1, "The email mentions an urgent request for information and requires immediate action to compile a list."
farmer-d_industrials_320, 1, "The email contains an urgent request and is related to a deal that requires immediate attention."
farmer-d_industrials_321, 1, "The email is marked as 'Urgent Request' and is related to an expired deal."
farmer-d_industrials_333, 1, "The email mentions that settlement is trying to close today and it is urgent to resolve the issue ASAP."
farmer-d_logistics_218, 1, "The email mentions an urgent request for information and requires immediate action to compile a list."
fischer-m_discussion_threads_312, 1, "The email explicitly mentions that the issue is critical and requires immediate action, with a deadline of end of business on July 10th."
fischer-m_discussion_threads_333, 2, "The email discusses the upcoming network cutover and its impact on operations, requiring employees to prepare for the change by the end of the day."
fischer-m_discussion_threads_64, 1, "The email explicitly mentions that it is an urgent work request."
fischer-m_notes_inbox_22, 1, "The email explicitly mentions that the issue is critical and requires immediate action, with a deadline of end of business on July 10th."
fischer-m_notes_inbox_6, 2, "The email discusses an upcoming change in the network that will impact access to resources and requires users to prepare for the transition."
forney-j_inbox_86, 1, "The email discusses an immediate threat of a virus circulating within the company's email system and requires immediate action to prevent further damage."
forney-j_inbox_87, 1, "This email discusses an immediate threat to the company's network and requires immediate action to prevent the spread of a virus."
forney-j_sent_items_160, 1, "The email is marked as urgent and mentions advice from the Legal Department, indicating immediate action is required."
forney-j_sent_items_415, 4, "The email provides contact information for the Frontera plant and does not require immediate action."
fossum-d_all_documents_1022, 1, "The email discusses an emergency network outage that requires immediate action to prevent data loss."
fossum-d_all_documents_845, 1, "The email mentions an emergency maintenance and provides a specific time window for the outage, requiring immediate attention."
fossum-d_all_documents_898, 1, "The email mentions an emergency maintenance and server outage, which requires immediate attention."
fossum-d_discussion_threads_650, 1, "The email mentions an emergency maintenance and server outage, which requires immediate attention."
fossum-d_discussion_threads_767, 1, "The email discusses an emergency network outage that requires immediate action to prevent data loss."
fossum-d_notes_inbox_162, 1, "The email mentions an emergency maintenance and server outage, which requires immediate attention."
fossum-d_notes_inbox_57, 1, "The email mentions an emergency network outage and requires immediate action to prevent data loss."
fossum-d__sent_mail_815, 1, "The email mentions 'urgent' in the subject and requests immediate advice."
gang-l_deleted_items_241, 3, "The email is requesting updated employee information for their database, with a deadline of May 15th, making it a medium priority."
gang-l_deleted_items_326, 1, "The email contains an urgent notification about server unavailability and requires immediate action to submit schedules before a specific time."
gang-l_deleted_items_481, 1, "The email mentions an urgent notice and requires immediate action to refrain from processing transactions in SAP."
gay-r_all_documents_15, 3, "The email discusses a meeting and funding issue, but there is no explicit urgency or deadline mentioned."
gay-r_all_documents_56, 4, "This email is informing about the sender's home leave and providing contact information for others during their absence, but no immediate action is required."
gay-r_all_documents_7, 1, "The email is marked as URGENT and discusses a conflict in meeting schedules."
gay-r_all_documents_86, 1, "The subject line contains 'URGENT' and the email discusses a draft that requires immediate attention."
gay-r_discussion_threads_22, 4, "This email is about informing the recipient about the sender's home leave and providing contact information for emergencies."
gay-r_sent_15, 3, "This email discusses a meeting and funding issue, but there is no explicit urgency or deadline mentioned."
geaccone-t_inbox_212, 3, "This email is about a new feature in the eHRonline system and requires employees to update their information, but there is no explicit urgency or deadline mentioned."
germany-c_all_documents_1432, 4, "This email is an informative update about a new travel and medical emergency assistance program, with no immediate action required."
germany-c_all_documents_1883, 4, "The email is informing about the sender's unavailability and provides alternative contact information, but no immediate action is required."
germany-c_all_documents_2530, 2, "The email mentions a deadline of 4:30 p.m. for turning in a contract number, making it a time-sensitive issue."
germany-c_bankrupt_tall_dominion_15, 1, "The subject line contains the word 'Urgent' and the sender plans to call again in an hour, indicating immediate action is required."
germany-c_bankrupt_transport_el_paso_3, 1, "The email mentions 'URGENT' in the subject and discusses a time-sensitive issue related to a meeting on the same day."
germany-c_ces_109, 4, "This is an out-of-office notification with no immediate action required."
germany-c_discussion_threads_1548, 3, "This email is about routine business inquiries and updates on ongoing projects."
germany-c_discussion_threads_258, 2, "The email mentions a deadline of 4:30 p.m. for turning in a contract number, indicating a time-sensitive issue."
germany-c_pending_4, 4, "This email is an informative update about a new travel and medical emergency assistance provider, with no immediate action required."
germany-c_sent_1202, 4, "This email is a casual out-of-office notification with no immediate action required."
germany-c_sent_1565, 2, "The email mentions a deadline of 4:30 p.m. for turning in a contract number, making it time-sensitive."
germany-c_systems_30, 3, "This email provides information about emergency contact numbers and a web-based system, but does not indicate an urgent issue or immediate action required."
gilbertsmith-d_deleted_items_26, 3, "This email contains routine updates on system availability and scheduled outages, with no explicit urgency."
gilbertsmith-d_inbox_19, 3, "The email discusses rescheduling a conference call and provides options, but does not indicate an urgent need for immediate action."
giron-d_deleted_items_60, 3, "This email provides information about weekend system outages and their impacts, but does not require immediate action or response."
griffith-j_all_documents_210, 1, "The email contains the word 'Urgent' in the subject and discusses a move request that needs to be addressed promptly."
griffith-j_all_documents_223, 1, "The email contains explicit mentions of urgency and requires immediate action for John Griffith to begin trading."
griffith-j_all_documents_236, 2, "The email discusses a delay in the shipment of monitor arms and provides an updated arrival time, requiring a timely response."
griffith-j_deleted_items_128, 3, "This email contains routine updates on system availability and scheduled outages, with no indication of urgency."
griffith-j_discussion_threads_187, 1, "The email subject and content mention 'Urgent' and request immediate action for a move."
griffith-j_discussion_threads_193, 1, "The email is discussing an urgent move request and requires immediate action."
griffith-j_discussion_threads_205, 1, "The email contains the word 'URGENT' and discusses an immediate need for approval."
griffith-j_discussion_threads_218, 2, "The email discusses a delay in the shipment of monitor arms and provides an updated arrival time, requiring a timely response."
griffith-j_move_3, 1, "The email contains an urgent move request and requires immediate action."
griffith-j_move_9, 2, "The email discusses a delay in the shipment of monitor arms, which may impact ongoing operations and requires a timely response."
grigsby-m_deleted_items_162, 2, "The email discusses phone interviews that need to be conducted, and the sender asks if they should call the candidates today."
grigsby-m_deleted_items_186, 1, "This email discusses an immediate crisis and requires immediate action to prevent the spread of a virus."
grigsby-m_sent_items_101, 2, "The email discusses a candidate for a job position and asks for a quick look and feedback, indicating a timely response is needed."
guzman-m_all_documents_1550, 1, "The email contains an urgent notification and requires immediate action to submit schedules before a specific time."
guzman-m_discussion_threads_1215, 4, "This email contains general information about Total Transfer Capabilities and is not time-sensitive."
guzman-m_discussion_threads_1252, 4, "This email is sharing general information about Total Transfer Capabilities and does not require immediate action."
guzman-m_discussion_threads_367, 1, "The email contains an urgent notification and requires immediate action to change the server."
guzman-m_discussion_threads_80, 2, "The email discusses benefits enrollment with a deadline of October 22, 2000, requiring action within a short time frame."
guzman-m_notes_inbox_1444, 1, "The email contains an urgent notification and requires immediate action to change the server and submit schedules before the specified time."
guzman-m_notes_inbox_652, 4, "This email is sharing general information about Total Transfer Capabilities and does not require immediate action."
haedicke-m_all_documents_1082, 3, "The email is about scheduling a meeting to discuss a monthly report, and the sender mentions that it is not too urgent."
haedicke-m_all_documents_1374, 1, "The email mentions a critical migration process with a deadline on the same day, and failure to act could result in significant delays and loss of information."
haedicke-m_all_documents_299, 1, "The email is marked as URGENT and discusses HR-related issues that need to be reviewed."
haedicke-m_deleted_items_78, 3, "The email is asking for comments on an agenda for a conference, but there is no explicit urgency or deadline mentioned."
haedicke-m_deleted_items_92, 4, "This is an out of office auto-reply, indicating no immediate response or action is required."
haedicke-m_inbox_245, 1, "The email discusses an immediate virus threat and requires immediate action to prevent further damage."
haedicke-m_inbox_593, 1, "The email mentions an urgent need to address a significant issue related to divestments and requires a response before the weekend."
haedicke-m_inbox_595, 2, "The email mentions a significant number of divestments and the need to sort out a waiver letter/procedure before the weekend, indicating a high priority and a same-day response."
haedicke-m_inbox_702, 1, "The email mentions that the transactions are very urgent and may raise cash, and the sender requests a call to discuss any questions."
haedicke-m_notes_inbox_5, 1, "The email mentions a critical migration process and potential loss of information if not addressed immediately."
haedicke-m_sent_252, 1, "The email is marked as URGENT and discusses HR-related issues that need to be reviewed."
haedicke-m_sent_660, 1, "The email is marked as urgent and discusses the need for additional legal resources."
hain-m_all_documents_1209, 4, "This email provides general information about a meeting and directs recipients to a website for more details."
hain-m_all_documents_1225, 3, "This email contains an update on SDG&E's actions and requests, but does not require immediate action or response."
hain-m_all_documents_545, 4, "This email is a casual update about a colleague's new job and contact information."
hain-m_all_documents_739, 3, "This email is an update on a change in operating procedures, but does not require immediate action or response."
hain-m_all_documents_922, 1, "The email is marked as urgent and requires immediate action to upgrade the browser before the implementation deadline."
hain-m_discussion_threads_120, 3, "This email contains an update on SDG&E's actions and requests, but does not require immediate action or response."
hain-m_discussion_threads_162, 1, "The email mentions an urgent issue and a deadline of 1/19, requiring immediate action and response."
hain-m_discussion_threads_164, 1, "The email mentions an urgent issue with a deadline of 1/19 and requires an immediate response."
hain-m_discussion_threads_165, 1, "The email mentions an emergency and requires a response ASAP, with a deadline of 1/19."
hain-m_discussion_threads_739, 4, "This email is a casual update about a colleague's new job and contact information, with no immediate action required."
hain-m_notes_inbox_628, 3, "This email is an update on a change in the ISO's operating procedures, but does not require immediate action or response."
hain-m_notes_inbox_778, 1, "The email is marked as urgent and requires immediate action to upgrade the browser before the implementation deadline."
hain-m_notes_inbox_798, 3, "This email is an update on new or revised operating procedures and provides a link for reference, but does not require immediate action."
hain-m__sent_mail_259, 1, "The email mentions an urgent issue with a deadline of 1/19 and requests an immediate response."
hain-m__sent_mail_305, 4, "This email provides general information about a meeting and directs to a website for more details."
hain-m__sent_mail_321, 3, "This email contains an update on SDG&E's actions and requests, but does not require immediate action or response."
harris-s_deleted_items_481, 2, "The email requests an urgent purchase of a Blackberry device and charger for Steve Harris, implying a need for a quick response."
hayslett-r_deleted_items_39, 1, "The subject line contains 'URGENT' and the email mentions a document awaiting signature."
hayslett-r_sent_items_381, 1, "The subject line contains the word 'URGENT' and the email is about taking immediate action."
hayslett-r_sent_items_73, 2, "The email mentions an 'emergency meeting' and asks for information about it."
heard-m_deleted_items_157, 2, "The email is marked as high importance and requests urgent assistance in obtaining specific documents."
heard-m_deleted_items_164, 1, "This email warns of an immediate threat of a virus circulating within the company's email system and requires immediate action to prevent potential harm."
heard-m_deleted_items_193, 4, "This is an out of office auto-reply, indicating no immediate response or action is required."
heard-m_inbox_309, 4, "This is an out of office auto-reply, indicating no immediate response or action is required."
hernandez-j_all_documents_305, 4, "This email is a casual joke and does not require immediate attention or response."
hernandez-j_discussion_threads_634, 4, "This email is a casual check-in and request for prayers, with no immediate action required."
hernandez-j_notes_inbox_70, 4, "This email is a casual check-in and request for prayers, with no immediate action required."
hodge-j_all_documents_260, 3, "Routine business inquiry and follow-up on previous discussions, no explicit urgency mentioned."
hodge-j_deleted_items_439, 2, "The email discusses the need for resolutions and actions related to selling a business and addressing smaller issues, with a sense of urgency."
hodge-j_inbox_13, 3, "This email contains routine updates on system availability and outages for the weekend, with no explicit urgency."
hodge-j_inbox_59, 1, "The email mentions an immediate threat of a virus circulating within the company's messaging environment and requires immediate action to delete the infected email."
